{
    "schemaVersion":  1,
    "channel":  "alpha",
    "version":  "0.1.0-alpha.1",
    "buildId":  "smoke.1",
    "publishedAtUtc":  "2026-05-10T22:30:10Z",
    "entryExecutable":  "SEROKAFrozenLegacy.exe",
    "notes":  "Genere automatiquement.",
    "files":  [
                  {
                      "path":  "SEROKAFrozenLegacy.exe",
                      "size":  100841984,
                      "sha256":  "050cfb32124938abd6ea54ddaed7f297f647eb267fd5493b9724eaf3d15af5b4",
                      "url":  "../payload/SEROKAFrozenLegacy.exe",
                      "required":  true
                  },
                  {
                      "path":  "SEROKAFrozenLegacy.pck",
                      "size":  103885544,
                      "sha256":  "f774c56b57c5fd4d49a6afc9c90ce9ccbe2b2ed57ddbdacf3a776961b07948af",
                      "url":  "../payload/SEROKAFrozenLegacy.pck",
                      "required":  true
                  }
              ]
}
